{
  "schemaVersion": 1,
  "updatedOn": "2026-10-10",
  "releaseStatus": "research-preview",
  "publicDataOnly": true,
  "notes": [
    "31 expedition ATK/DEF source-table rows populated for all 37 heroes; exceptional Amadeus and Diana progression use distinct, directly read primary sources.",
    "Verified star mapping: one-based row = 6*fullStars + partialTiers + 1; 1,065 shard costs in blocks 10/40/115/300/600.",
    "Legacy 'shardsToNextRow' JSON key describes costs printed for REACHING each row; row 1=0, row 31=100.",
    "Hero skills have separate source provenance. Complete level-1-to-80 conquest bases are not known and remain null.",
    "No personal player IDs, names, inventories, screenshots or account records allowed."
  ],
  "records": [
    {
      "id": "olive",
      "name": "Olive",
      "troopType": "archer",
      "generation": 1,
      "status": "partial-sourced",
      "source": {
        "catalog": "catalog.v1.json",
        "stats": "https://kingshotdata.com/heroes/olive/",
        "verifiedOn": "2026-10-10",
        "skillSource": "https://github.com/g2384/Kingshot-Data/blob/main/heroes2.json",
        "skillVerification": "secondary-only"
      },
      "starProgression": {
        "sourceRowIndices": "1..31",
        "rowToDisplayStarTier": "validated-six-steps-per-star",
        "expeditionAttackPercent": [
          11.36,
          12.42,
          13.48,
          14.54,
          15.59,
          16.65,
          18.55,
          20.03,
          21.51,
          23,
          24.48,
          25.96,
          28.62,
          30.69,
          32.76,
          34.84,
          36.91,
          38.98,
          42.71,
          45.62,
          48.51,
          51.42,
          54.32,
          57.22,
          62.45,
          66.51,
          70.57,
          74.63,
          78.7,
          82.76,
          90.07
        ],
        "expeditionDefensePercent": [
          11.36,
          12.42,
          13.48,
          14.54,
          15.59,
          16.65,
          18.55,
          20.03,
          21.51,
          23,
          24.48,
          25.96,
          28.62,
          30.69,
          32.76,
          34.84,
          36.91,
          38.98,
          42.71,
          45.62,
          48.51,
          51.42,
          54.32,
          57.22,
          62.45,
          66.51,
          70.57,
          74.63,
          78.7,
          82.76,
          90.07
        ],
        "shardsToNextRow": [
          0,
          1,
          1,
          2,
          2,
          2,
          2,
          5,
          5,
          5,
          5,
          5,
          15,
          15,
          15,
          15,
          15,
          15,
          40,
          40,
          40,
          40,
          40,
          40,
          100,
          100,
          100,
          100,
          100,
          100,
          100
        ]
      },
      "expeditionSkills": [
        {
          "name": "Green Thumb",
          "effect": "mill_income",
          "metric": "percent",
          "valuesBySkillLevel": [
            5,
            10,
            15,
            20,
            25
          ],
          "conditions": {}
        },
        {
          "name": "Forager’s Luck",
          "effect": "bread_gathering_speed",
          "metric": "percent",
          "valuesBySkillLevel": [
            5,
            10,
            15,
            20,
            25
          ],
          "conditions": {}
        }
      ],
      "conquestBaseByHeroLevel": null
    },
    {
      "id": "edwin",
      "name": "Edwin",
      "troopType": "cavalry",
      "generation": 1,
      "status": "partial-sourced",
      "source": {
        "catalog": "catalog.v1.json",
        "stats": "https://kingshotdata.com/heroes/edwin/",
        "verifiedOn": "2026-10-10",
        "skillSource": "https://github.com/g2384/Kingshot-Data/blob/main/heroes2.json",
        "skillVerification": "secondary-only"
      },
      "starProgression": {
        "sourceRowIndices": "1..31",
        "rowToDisplayStarTier": "validated-six-steps-per-star",
        "expeditionAttackPercent": [
          11.36,
          12.42,
          13.48,
          14.54,
          15.59,
          16.65,
          18.55,
          20.03,
          21.51,
          23,
          24.48,
          25.96,
          28.62,
          30.69,
          32.76,
          34.84,
          36.91,
          38.98,
          42.71,
          45.62,
          48.51,
          51.42,
          54.32,
          57.22,
          62.45,
          66.51,
          70.57,
          74.63,
          78.7,
          82.76,
          90.07
        ],
        "expeditionDefensePercent": [
          11.36,
          12.42,
          13.48,
          14.54,
          15.59,
          16.65,
          18.55,
          20.03,
          21.51,
          23,
          24.48,
          25.96,
          28.62,
          30.69,
          32.76,
          34.84,
          36.91,
          38.98,
          42.71,
          45.62,
          48.51,
          51.42,
          54.32,
          57.22,
          62.45,
          66.51,
          70.57,
          74.63,
          78.7,
          82.76,
          90.07
        ],
        "shardsToNextRow": [
          0,
          1,
          1,
          2,
          2,
          2,
          2,
          5,
          5,
          5,
          5,
          5,
          15,
          15,
          15,
          15,
          15,
          15,
          40,
          40,
          40,
          40,
          40,
          40,
          100,
          100,
          100,
          100,
          100,
          100,
          100
        ]
      },
      "expeditionSkills": [
        {
          "name": "Demolitions Expert",
          "effect": "quarry_income",
          "metric": "percent",
          "valuesBySkillLevel": [
            5,
            10,
            15,
            20,
            25
          ],
          "conditions": {}
        },
        {
          "name": "Stone Mining",
          "effect": "stone_gathering_speed",
          "metric": "percent",
          "valuesBySkillLevel": [
            5,
            10,
            15,
            20,
            25
          ],
          "conditions": {}
        }
      ],
      "conquestBaseByHeroLevel": null
    },
    {
      "id": "forrest",
      "name": "Forrest",
      "troopType": "infantry",
      "generation": 1,
      "status": "partial-sourced",
      "source": {
        "catalog": "catalog.v1.json",
        "stats": "https://kingshotdata.com/heroes/forrest/",
        "verifiedOn": "2026-10-10",
        "skillSource": "https://github.com/g2384/Kingshot-Data/blob/main/heroes2.json",
        "skillVerification": "secondary-only"
      },
      "starProgression": {
        "sourceRowIndices": "1..31",
        "rowToDisplayStarTier": "validated-six-steps-per-star",
        "expeditionAttackPercent": [
          11.36,
          12.42,
          13.48,
          14.54,
          15.59,
          16.65,
          18.55,
          20.03,
          21.51,
          23,
          24.48,
          25.96,
          28.62,
          30.69,
          32.76,
          34.84,
          36.91,
          38.98,
          42.71,
          45.62,
          48.51,
          51.42,
          54.32,
          57.22,
          62.45,
          66.51,
          70.57,
          74.63,
          78.7,
          82.76,
          90.07
        ],
        "expeditionDefensePercent": [
          11.36,
          12.42,
          13.48,
          14.54,
          15.59,
          16.65,
          18.55,
          20.03,
          21.51,
          23,
          24.48,
          25.96,
          28.62,
          30.69,
          32.76,
          34.84,
          36.91,
          38.98,
          42.71,
          45.62,
          48.51,
          51.42,
          54.32,
          57.22,
          62.45,
          66.51,
          70.57,
          74.63,
          78.7,
          82.76,
          90.07
        ],
        "shardsToNextRow": [
          0,
          1,
          1,
          2,
          2,
          2,
          2,
          5,
          5,
          5,
          5,
          5,
          15,
          15,
          15,
          15,
          15,
          15,
          40,
          40,
          40,
          40,
          40,
          40,
          100,
          100,
          100,
          100,
          100,
          100,
          100
        ]
      },
      "expeditionSkills": [
        {
          "name": "Woodland Inheritor",
          "effect": "logging_income",
          "metric": "percent",
          "valuesBySkillLevel": [
            5,
            10,
            15,
            20,
            25
          ],
          "conditions": {}
        },
        {
          "name": "Master Woodcutter",
          "effect": "wood_gathering_speed",
          "metric": "percent",
          "valuesBySkillLevel": [
            5,
            10,
            15,
            20,
            25
          ],
          "conditions": {}
        }
      ],
      "conquestBaseByHeroLevel": null
    },
    {
      "id": "seth",
      "name": "Seth",
      "troopType": "infantry",
      "generation": 1,
      "status": "partial-sourced",
      "source": {
        "catalog": "catalog.v1.json",
        "stats": "https://kingshotdata.com/heroes/seth/",
        "verifiedOn": "2026-10-10",
        "skillSource": "https://github.com/g2384/Kingshot-Data/blob/main/heroes2.json",
        "skillVerification": "secondary-only"
      },
      "starProgression": {
        "sourceRowIndices": "1..31",
        "rowToDisplayStarTier": "validated-six-steps-per-star",
        "expeditionAttackPercent": [
          11.36,
          12.42,
          13.48,
          14.54,
          15.59,
          16.65,
          18.55,
          20.03,
          21.51,
          23,